ID,Title,Keywords,Link,Embedding Dim
0,Mice in Bion-M 1 space mission: training and selection,"mice bion space, mice bion, mice, bion space mission, bion space, bion, space mission training, space mission",https://www.ncbi.nlm.nih.gov/pmc/articles/PMC4136787/,1536
1,"Microgravity induces pelvic bone loss through osteoclastic activity, osteocytic osteolysis, and osteoblastic cell cycle inhibition by CDKN1a/p21","microgravity induces pelvic, microgravity induces, loss osteoclastic activity, osteolysis osteoblastic cell, osteoclastic activity osteocytic, induces pelvic bone, bone loss osteoclastic, osteoclastic activity",https://www.ncbi.nlm.nih.gov/pmc/articles/PMC3630201/,1536
2,Stem Cell Health and Tissue Regeneration in Microgravity,"tissue regeneration microgravity, regeneration microgravity, stem cell, microgravity, health tissue regeneration, tissue regeneration, stem cell health, regeneration",https://www.ncbi.nlm.nih.gov/pmc/articles/PMC11988870/,1536
3,Microgravity Reduces the Differentiation and Regenerative Potential of Embryonic Stem Cells,"microgravity reduces differentiation, embryonic stem cells, potential embryonic stem, stem cells, microgravity, embryonic stem, microgravity reduces, regenerative potential embryonic",https://www.ncbi.nlm.nih.gov/pmc/articles/PMC7998608/,1536
4,Microgravity validation of a novel system for RNA isolation and multiplex quantitative real time PCR analysis of gene expression on the International Space Station,"pcr analysis gene, rna isolation multiplex, rna isolation, novel rna isolation, analysis gene expression, microgravity validation novel, pcr analysis, microgravity validation",https://www.ncbi.nlm.nih.gov/pmc/articles/PMC5587110/,1536
5,Spaceflight Modulates the Expression of Key Oxidative Stress and Cell Cycle Related Genes in Heart,"genes heart, related genes heart, oxidative stress cell, key oxidative stress, oxidative stress, expression key oxidative, spaceflight modulates expression, key oxidative",https://www.ncbi.nlm.nih.gov/pmc/articles/PMC8396460/,1536
6,Dose- and Ion-Dependent Effects in the Oxidative Stress Response to Space-Like Radiation Exposure in the Skeletal System,"radiation exposure skeletal, radiation exposure, effects oxidative stress, oxidative stress, oxidative stress response, radiation, exposure skeletal, effects oxidative",https://www.ncbi.nlm.nih.gov/pmc/articles/PMC5666799/,1536
7,From the bench to exploration medicine: NASA life sciences translational research for human exploration and habitation missions.,"exploration medicine nasa, exploration medicine, medicine nasa life, medicine nasa, exploration habitation missions, nasa life sciences, research human exploration, human exploration habitation",https://www.ncbi.nlm.nih.gov/pmc/articles/PMC5460236/,1536
8,High-precision method for cyclic loading of small-animal vertebrae to assess bone quality.,"vertebrae assess bone, animal vertebrae assess, assess bone quality, assess bone, vertebrae assess, animal vertebrae, small animal vertebrae, bone quality",https://www.ncbi.nlm.nih.gov/pmc/articles/PMC6222041/,1536
9,Effects of ex vivo ionizing radiation on collagen structure and whole-bone mechanical properties of mouse vertebrae.,"ionizing radiation collagen, radiation collagen, radiation collagen structure, vivo ionizing radiation, properties mouse vertebrae, collagen structure bone, mouse vertebrae, collagen structure",https://www.ncbi.nlm.nih.gov/pmc/articles/PMC6813909/,1536
10,Absence of gamma-sarcoglycan alters the response of p70S6 kinase to mechanical perturbation in murine skeletal muscle,"p70s6 kinase mechanical, response p70s6 kinase, p70s6 kinase, kinase mechanical, gamma sarcoglycan alters, skeletal muscle, murine skeletal muscle, kinase mechanical perturbation",https://www.ncbi.nlm.nih.gov/pmc/articles/PMC4095884/,1536
11,AtRabD2b and AtRabD2c have overlapping functions in pollen development and pollen tube growth.,"functions pollen development, pollen development, development pollen tube, pollen development pollen, pollen tube growth, development pollen, functions pollen, atrabd2b atrabd2c overlapping",https://www.ncbi.nlm.nih.gov/pmc/articles/PMC3040128/,1536
12,TNO1 is involved in salt tolerance and vacuolar trafficking in Arabidopsis.,"tno1 involved salt, vacuolar trafficking arabidopsis, trafficking arabidopsis, salt tolerance vacuolar, tno1 involved, tno1, tolerance vacuolar trafficking, arabidopsis",https://www.ncbi.nlm.nih.gov/pmc/articles/PMC3177255/,1536
13,Functional redundancy between trans-Golgi network SNARE family members in Arabidopsis thaliana.,"golgi network snare, network snare family, trans golgi network, snare family, snare family members, redundancy trans golgi, network snare, golgi network",https://www.ncbi.nlm.nih.gov/pmc/articles/PMC11500582/,1536
14,Root growth movements: Waving and skewing.,"root growth movements, root growth, growth movements waving, growth movements, root, growth, movements waving skewing, waving skewing",https://www.ncbi.nlm.nih.gov/pmc/articles/PMC5387210/,1536
15,Gravitropism and lateral root emergence are dependent on the trans-Golgi network protein TNO1,"golgi network protein, gravitropism lateral root, dependent trans golgi, network protein tno1, protein tno1, gravitropism lateral, trans golgi network, lateral root emergence",https://www.ncbi.nlm.nih.gov/pmc/articles/PMC4642138/,1536
16,"TNO1, a TGN-localized SNARE-interacting protein, modulates root skewing in Arabidopsis thaliana.","root skewing arabidopsis, skewing arabidopsis, skewing arabidopsis thaliana, snare interacting protein, protein modulates root, arabidopsis, arabidopsis thaliana, modulates root skewing",https://www.ncbi.nlm.nih.gov/pmc/articles/PMC5387210/,1536
17,The Drosophila SUN protein Spag4 cooperates with the coiled-coil protein Yuri Gagarin to maintain association of the basal body and spermatid nucleus.,"drosophila sun protein, sun protein spag4, protein yuri gagarin, protein spag4 cooperates, coil protein yuri, protein spag4, drosophila sun, spag4 cooperates coiled",https://www.ncbi.nlm.nih.gov/pmc/articles/PMC2915878/,1536
18,Toll mediated infection response is altered by gravity and spaceflight in Drosophila,"gravity spaceflight drosophila, toll mediated infection, spaceflight drosophila, toll mediated, drosophila, gravity spaceflight, toll, altered gravity spaceflight",https://www.ncbi.nlm.nih.gov/pmc/articles/PMC3901686/,1536
19,Multi-omics analysis of multiple missions to space reveal a theme of lipid dysregulation in mouse liver,"dysregulation mouse liver, lipid dysregulation mouse, lipid dysregulation, mouse liver, theme lipid dysregulation, lipid, dysregulation mouse, liver",https://www.ncbi.nlm.nih.gov/pmc/articles/PMC6985101/,1536
20,GeneLab database analyses suggest long-term impact of space radiation on the cardiovascular system by the activation of FYN through reactive oxygen species.,"space radiation cardiovascular, radiation cardiovascular activation, radiation cardiovascular, cardiovascular activation fyn, fyn reactive oxygen, space radiation, radiation, reactive oxygen",https://www.ncbi.nlm.nih.gov/pmc/articles/PMC6387434/,1536
21,FAIRness and usability for open-access omics data systems.,"omics data systems, fairness usability open, open access omics, fairness usability, access omics, access omics data, omics data, usability open access",https://www.ncbi.nlm.nih.gov/pmc/articles/PMC6371294/,1536
22,NASA GeneLab platform utilized for biological response to space radiation in animal models,"nasa genelab platform, space radiation animal, nasa genelab, radiation animal models, genelab platform, genelab platform utilized, radiation animal, space radiation",https://www.ncbi.nlm.nih.gov/pmc/articles/PMC7072278/,1536
23,Circulating miRNA spaceflight signature reveals targets for countermeasure development,"circulating mirna spaceflight, mirna spaceflight signature, circulating mirna, mirna spaceflight, spaceflight signature reveals, spaceflight signature, mirna, reveals targets countermeasure",https://www.ncbi.nlm.nih.gov/pmc/articles/PMC8441986/,1536
24,Machine learning algorithm to characterize antimicrobial resistance associated with the International Space Station surface microbiome,"characterize antimicrobial resistance, station surface microbiome, algorithm characterize antimicrobial, antimicrobial resistance, antimicrobial resistance associated, characterize antimicrobial, surface microbiome, microbiome",https://www.ncbi.nlm.nih.gov/pmc/articles/PMC9400218/,1536
25,Extraterrestrial Gynecology: Could Spaceflight Increase the Risk of Developing Cancer in Female Astronauts? An Updated Review,"extraterrestrial gynecology spaceflight, gynecology spaceflight increase, cancer female astronauts, gynecology spaceflight, extraterrestrial gynecology, female astronauts, female astronauts updated, developing cancer female",https://www.ncbi.nlm.nih.gov/pmc/articles/PMC9267413/,1536
26,Muscle atrophy phenotype gene expression during spaceflight is linked to a metabolic crosstalk in both the liver and the muscle in mice.,"spaceflight linked metabolic, muscle atrophy phenotype, liver muscle mice, gene expression spaceflight, metabolic crosstalk liver, crosstalk liver muscle, atrophy phenotype gene, muscle atrophy",https://www.ncbi.nlm.nih.gov/pmc/articles/PMC9576569/,1536
27,Chromosomal positioning and epigenetic architecture influence DNA methylation patterns triggered by galactic cosmic radiation,"chromosomal positioning epigenetic, dna methylation patterns, positioning epigenetic, influence dna methylation, dna methylation, positioning epigenetic architecture, epigenetic architecture influence, epigenetic",https://www.ncbi.nlm.nih.gov/pmc/articles/PMC10789781/,1536
28,"A comprehensive SARS-CoV-2 and COVID-19 review, Part 2: Host extracellular to systemic effects of SARS-CoV-2 infection","sars cov infection, sars cov covid, effects sars cov, sars cov, comprehensive sars cov, systemic effects sars, cov covid 19, cov infection",https://www.ncbi.nlm.nih.gov/pmc/articles/PMC10772081/,1536
29,Aging and putative frailty biomarkers are altered by spaceflight,"putative frailty biomarkers, frailty biomarkers altered, frailty biomarkers, biomarkers altered spaceflight, aging putative frailty, aging, putative frailty, aging putative",https://www.ncbi.nlm.nih.gov/pmc/articles/PMC11166946/,1536
30,Space radiation damage rescued by inhibition of key spaceflight associated miRNAs,"spaceflight associated mirnas, space radiation damage, space radiation, associated mirnas, radiation damage, mirnas, radiation damage rescued, inhibition key spaceflight",https://www.ncbi.nlm.nih.gov/pmc/articles/PMC11166944/,1536
31,Ethical considerations for the age of non-governmental space exploration,"governmental space exploration, space exploration, non governmental space, ethical considerations age, ethical considerations, governmental space, ethical, exploration",https://www.ncbi.nlm.nih.gov/pmc/articles/PMC11166968/,1536
32,Innate immune responses of Drosophila melanogaster are altered by spaceflight.,"immune responses drosophila, responses drosophila melanogaster, responses drosophila, innate immune responses, drosophila melanogaster, drosophila melanogaster altered, innate immune, drosophila",https://www.ncbi.nlm.nih.gov/pmc/articles/PMC7000411/,1536
33,Prolonged Exposure to Microgravity Reduces Cardiac Contractility and Initiates Remodeling in Drosophila,"microgravity reduces cardiac, prolonged exposure microgravity, reduces cardiac contractility, remodeling drosophila, cardiac contractility initiates, exposure microgravity reduces, initiates remodeling drosophila, cardiac contractility",https://www.ncbi.nlm.nih.gov/pmc/articles/PMC7787258/,1536
34,Regulation of plant gravity sensing and signaling by the actin cytoskeleton.,"signaling actin cytoskeleton, actin cytoskeleton, plant gravity sensing, regulation plant gravity, sensing signaling actin, plant gravity, signaling actin, cytoskeleton",https://www.ncbi.nlm.nih.gov/pmc/articles/PMC8716943/,1536
35,HLB1 Is a Tetratricopeptide Repeat Domain-Containing Protein That Operates at the Intersection of the Exocytic and Endocytic Pathways at the TGN/EE in Arabidopsis,"hlb1 tetratricopeptide repeat, hlb1 tetratricopeptide, endocytic pathways tgn, tgn ee arabidopsis, exocytic endocytic pathways, endocytic pathways, tetratricopeptide repeat domain, hlb1",https://www.ncbi.nlm.nih.gov/pmc/articles/PMC4826010/,1536
36,ERULUS is a plasma membrane-localized receptor-like kinase that specifies root hair growth by maintaining tip-focused cytoplasmic calcium oscillations.,"root hair growth, root hair, erulus plasma membrane, erulus, kinase specifies root, specifies root hair, erulus plasma, focused cytoplasmic calcium",https://www.ncbi.nlm.nih.gov/pmc/articles/PMC6048781/,1536
37,Brassinosteroids inhibit autotropic root straightening by modifying filamentous-actin organization and dynamics.,"brassinosteroids inhibit autotropic, autotropic root straightening, brassinosteroids inhibit, root straightening, root straightening modifying, brassinosteroids, inhibit autotropic root, modifying filamentous actin",https://www.ncbi.nlm.nih.gov/pmc/articles/PMC7010715/,1536
38,Cell type-specific imaging of calcium signaling in Arabidopsis thaliana seedling roots using GCaMP3.,"calcium signaling arabidopsis, imaging calcium signaling, signaling arabidopsis, calcium signaling, signaling arabidopsis thaliana, arabidopsis thaliana seedling, imaging calcium, roots using gcamp3",https://www.ncbi.nlm.nih.gov/pmc/articles/PMC7503278/,1536
39,Spatial and temporal localization of SPIRRIG and WAVE/SCAR reveal roles for these proteins in actin-mediated root hair development.,"actin mediated root, root hair development, mediated root hair, proteins actin mediated, roles proteins actin, root hair, proteins actin, actin mediated",https://www.ncbi.nlm.nih.gov/pmc/articles/PMC8364238/,1536
40,Microgravity Stress: Bone and Connective Tissue,"microgravity stress bone, microgravity stress, stress bone connective, stress bone, microgravity, bone connective tissue, bone connective, bone",https://www.ncbi.nlm.nih.gov/pmc/articles/PMC11579474/,1536
41,S. aureus MscL is a pentamer in vivo but of variable stoichiometries in vitro: implications for detergent-solubilized membrane proteins,"detergent solubilized membrane, solubilized membrane proteins, aureus mscl, aureus mscl pentamer, membrane proteins, solubilized membrane, detergent solubilized, implications detergent solubilized",https://www.ncbi.nlm.nih.gov/pmc/articles/PMC2998437/,1536
42,Manipulating the permeation of charged compounds through the MscL nanovalve.,"compounds mscl nanovalve, mscl nanovalve, charged compounds mscl, permeation charged compounds, manipulating permeation charged, nanovalve, compounds mscl, permeation charged",https://www.ncbi.nlm.nih.gov/pmc/articles/PMC3005423/,1536
43,The oligomeric state of the truncated mechanosensitive channel of large conductance shows no variance in vivo.,"mechanosensitive channel large, mechanosensitive channel, truncated mechanosensitive channel, channel large conductance, conductance shows variance, mechanosensitive, state truncated mechanosensitive, large conductance",https://www.ncbi.nlm.nih.gov/pmc/articles/PMC3190158/,1536
44,Three routes to modulate the pore size of the MscL channel/nanovalve,"mscl channel nanovalve, pore size mscl, modulate pore size, channel nanovalve, pore size, modulate pore, size mscl channel, routes modulate pore",https://www.ncbi.nlm.nih.gov/pmc/articles/PMC3289768/,1536
45,The dynamics of protein-protein interactions between domains of MscL at the cytoplasmic-lipid interface,"mscl cytoplasmic lipid, domains mscl cytoplasmic, cytoplasmic lipid interface, protein interactions domains, mscl cytoplasmic, protein protein interactions, cytoplasmic lipid, protein interactions",https://www.ncbi.nlm.nih.gov/pmc/articles/PMC3508904/,1536
46,The MscS and MscL families of mechanosensitive channels act as microbial emergency release valves,"channels act microbial, microbial emergency release, emergency release valves, act microbial emergency, release valves, microbial emergency, mechanosensitive channels act, act microbial",https://www.ncbi.nlm.nih.gov/pmc/articles/PMC3430326/,1536
47,Chimeras reveal a single lipid-interface residue that controls MscL channel kinetics as well as mechanosensitivity,"channel kinetics mechanosensitivity, lipid interface, mscl channel kinetics, lipid interface residue, single lipid interface, chimeras reveal, kinetics mechanosensitivity, chimeras reveal single",https://www.ncbi.nlm.nih.gov/pmc/articles/PMC3593973/,1536
48,Evidence for extensive horizontal gene transfer from the draft genome of a tardigrade,"draft genome tardigrade, genome tardigrade, transfer draft genome, horizontal gene transfer, gene transfer draft, draft genome, tardigrade, extensive horizontal gene",https://www.ncbi.nlm.nih.gov/pmc/articles/PMC5018776/,1536
49,Reply to Bemm et al. and Arakawa: Identifying foreign genes in independent Hypsibius dujardini genome assemblies,"hypsibius dujardini genome, dujardini genome assemblies, dujardini genome, genes independent hypsibius, independent hypsibius dujardini, hypsibius dujardini, foreign genes independent, identifying foreign genes",https://www.ncbi.nlm.nih.gov/pmc/articles/PMC4896697/,1536
50,Tardigrades Use Intrinsically Disordered Proteins to Survive Desiccation.,"tardigrades use intrinsically, tardigrades use, tardigrades, proteins survive desiccation, disordered proteins survive, intrinsically disordered proteins, disordered proteins, proteins survive",https://www.ncbi.nlm.nih.gov/pmc/articles/PMC11127935/,1536
51,Desiccation of Hypsibius exemplaris,"desiccation hypsibius exemplaris, desiccation hypsibius, hypsibius exemplaris, hypsibius, desiccation, exemplaris",https://www.ncbi.nlm.nih.gov/pmc/articles/PMC11831363/,1536
52,The biology of tardigrade disordered proteins in extreme stress tolerance.,"tardigrade disordered proteins, biology tardigrade disordered, disordered proteins extreme, proteins extreme stress, disordered proteins, tardigrade disordered, biology tardigrade, proteins extreme",https://www.ncbi.nlm.nih.gov/pmc/articles/PMC11930778/,1536
53,Production of reactive oxygen species and involvement of bioprotectants during anhydrobiosis in the tardigrade Paramacrobiotus spatialis,"bioprotectants anhydrobiosis tardigrade, anhydrobiosis tardigrade paramacrobiotus, bioprotectants anhydrobiosis, involvement bioprotectants anhydrobiosis, anhydrobiosis tardigrade, anhydrobiosis, tardigrade paramacrobiotus spatialis, tardigrade paramacrobiotus",https://www.ncbi.nlm.nih.gov/pmc/articles/PMC8816950/,1536
54,Partial weight suspension: A novel murine model for investigating adaptation to reduced musculoskeletal loading.,"reduced musculoskeletal loading, musculoskeletal loading, adaptation reduced musculoskeletal, reduced musculoskeletal, weight suspension, weight suspension novel, musculoskeletal, partial weight suspension",https://www.ncbi.nlm.nih.gov/pmc/articles/PMC3774184/,1536
55,"Partial reductions in mechanical loading yield proportional changes in bone density, bone architecture, and muscle mass","changes bone density, proportional changes bone, bone density, density bone architecture, reductions mechanical loading, bone architecture muscle, bone density bone, architecture muscle mass",https://www.ncbi.nlm.nih.gov/pmc/articles/PMC4118556/,1536
56,Spaceflight and hind limb unloading induce similar changes in electrical impedance characteristics of mouse gastrocnemius muscle,"mouse gastrocnemius muscle, impedance characteristics mouse, characteristics mouse gastrocnemius, limb unloading induce, gastrocnemius muscle, mouse gastrocnemius, spaceflight hind limb, hind limb unloading",https://www.ncbi.nlm.nih.gov/pmc/articles/PMC4653813/,1536
57,Spaceflight Activates Lipotoxic Pathways in Mouse Liver,"spaceflight activates lipotoxic, lipotoxic pathways mouse, activates lipotoxic pathways, activates lipotoxic, spaceflight, lipotoxic pathways, mouse liver, pathways mouse liver",https://www.ncbi.nlm.nih.gov/pmc/articles/PMC6915713/,1536
58,Treatment with a soluble bone morphogenetic protein type 1A receptor (BMPR1A) fusion protein increases bone mass and bone formation in mice subjected to hindlimb unloading.,"bone morphogenetic protein, protein increases bone, bone formation mice, mass bone formation, increases bone mass, bone mass bone, increases bone, receptor bmpr1a fusion",https://www.ncbi.nlm.nih.gov/pmc/articles/PMC6124165/,1536
59,RNAseq and RNA molecular barcoding reveal differential gene expression in cortical bone following hindlimb unloading in female mice,"expression cortical bone, rna molecular barcoding, rnaseq rna, cortical bone, gene expression cortical, rnaseq rna molecular, bone following hindlimb, cortical bone following",https://www.ncbi.nlm.nih.gov/pmc/articles/PMC8509868/,1536
60,Proteomic and phosphoproteomic characterization of cardiovascular tissues after long term exposure to simulated space radiation,"phosphoproteomic characterization cardiovascular, proteomic phosphoproteomic, proteomic phosphoproteomic characterization, space radiation, characterization cardiovascular tissues, cardiovascular tissues, simulated space radiation, characterization cardiovascular",https://www.ncbi.nlm.nih.gov/pmc/articles/PMC11063234/,1536
61,Adaptive Changes in the Vestibular System of Land Snail to a 30-Day Spaceflight and Readaptation on Return to Earth,"vestibular land snail, changes vestibular land, adaptive changes vestibular, land snail, vestibular land, land snail 30, snail, snail 30 day",https://www.ncbi.nlm.nih.gov/pmc/articles/PMC5672023/,1536
62,"Morphology of the Utricular Otolith Organ in the Toadfish, Opsanus tau","otolith organ toadfish, morphology utricular otolith, utricular otolith organ, utricular otolith, organ toadfish opsanus, otolith organ, organ toadfish, toadfish opsanus tau",https://www.ncbi.nlm.nih.gov/pmc/articles/PMC5899691/,1536
63,"Influence of Magnitude and Duration of Altered Gravity and Readaptation to 1g on the Structure and Function of the Utricle in Toadfish, Opsanus tau.","function utricle toadfish, utricle toadfish opsanus, utricle toadfish, toadfish opsanus tau, toadfish opsanus, toadfish, structure function utricle, altered gravity readaptation",https://www.ncbi.nlm.nih.gov/pmc/articles/PMC6204554/,1536
64,Organization of the ER-Golgi interface for membrane traffic control.,"golgi interface membrane, membrane traffic control, interface membrane traffic, membrane traffic, er golgi interface, golgi interface, interface membrane, membrane",https://www.ncbi.nlm.nih.gov/pmc/articles/PMC4064004/,1536
65,IRE1: ER stress sensor and cell fate executor.,"er stress sensor, stress sensor cell, ire1 er stress, cell fate executor, er stress, sensor cell fate, stress sensor, cell fate",https://www.ncbi.nlm.nih.gov/pmc/articles/PMC3818365/,1536
66,Inter-regulation of the unfolded protein response and auxin signaling.,"response auxin signaling, regulation unfolded protein, auxin signaling, protein response auxin, unfolded protein response, unfolded protein, response auxin, auxin",https://www.ncbi.nlm.nih.gov/pmc/articles/PMC3981873/,1536
67,Endoplasmic reticulum-shape and function in stress translation,"endoplasmic reticulum, endoplasmic reticulum shape, reticulum shape function, function stress translation, endoplasmic, reticulum, reticulum shape, stress translation",https://www.ncbi.nlm.nih.gov/pmc/articles/PMC4150462/,1536
68,Galactose-depleted xycoglucan is dysfunctional and leads to dwarfism in Arabidopsis,"galactose depleted xycoglucan, dwarfism arabidopsis, leads dwarfism arabidopsis, depleted xycoglucan dysfunctional, xycoglucan dysfunctional, galactose depleted, depleted xycoglucan, xycoglucan dysfunctional leads",https://www.ncbi.nlm.nih.gov/pmc/articles/PMC4378170/,1536
69,"Unfolded protein response in plants: one master, many questions.","unfolded protein response, protein response plants, unfolded protein, protein response, response plants, protein, response plants master, unfolded",https://www.ncbi.nlm.nih.gov/pmc/articles/PMC4618186/,1536
70,Vesicles versus Tubes: Is Endoplasmic Reticulum-Golgi Transport in Plants Fundamentally Different from Other Eukaryotes?,"reticulum golgi transport, endoplasmic reticulum golgi, tubes endoplasmic reticulum, golgi transport plants, vesicles versus tubes, endoplasmic reticulum, transport plants fundamentally, vesicles versus",https://www.ncbi.nlm.nih.gov/pmc/articles/PMC4453782/,1536
71,Pectin methylesterification impacts the relationship between photosynthesis and plant growth.,"pectin methylesterification impacts, pectin methylesterification, photosynthesis plant growth, photosynthesis, plant growth, photosynthesis plant, methylesterification impacts relationship, impacts relationship photosynthesis",https://www.ncbi.nlm.nih.gov/pmc/articles/PMC4902601/,1536
72,Reduced Chloroplast Coverage genes from Arabidopsis thaliana help to establish the size of the chloroplast compartment,"chloroplast coverage genes, reduced chloroplast coverage, chloroplast compartment, size chloroplast compartment, chloroplast coverage, reduced chloroplast, establish size chloroplast, coverage genes arabidopsis",https://www.ncbi.nlm.nih.gov/pmc/articles/PMC4776492/,1536
73,Maintaining the factory: The roles of the unfolded protein response in cellular homeostasis in plants.,"roles unfolded protein, unfolded protein response, cellular homeostasis plants, unfolded protein, homeostasis plants, protein response cellular, response cellular homeostasis, cellular homeostasis",https://www.ncbi.nlm.nih.gov/pmc/articles/PMC5415411/,1536
74,NADPH oxidase activity is required for ER stress survival in plants.,"nadph oxidase activity, nadph oxidase, stress survival plants, oxidase activity required, oxidase activity, er stress survival, oxidase, required er stress",https://www.ncbi.nlm.nih.gov/pmc/articles/PMC6289879/,1536
