ID,Title,Keywords,Link,Embedding Dim
438,Caenorhabditis elegans in microgravity: An omics perspective,"caenorhabditis elegans microgravity, elegans microgravity omics, elegans microgravity, caenorhabditis elegans, elegans, microgravity omics, microgravity, microgravity omics perspective",https://www.ncbi.nlm.nih.gov/pmc/articles/PMC10344948/,1536
439,Dried plum diet protects from bone loss caused by ionizing radiation,"plum diet protects, dried plum diet, plum diet, diet protects bone, dried plum, protects bone loss, bone loss, bone loss caused",https://www.ncbi.nlm.nih.gov/pmc/articles/PMC4750446/,1536
440,Dietary countermeasure mitigates simulated spaceflight-induced osteopenia in mice,"induced osteopenia mice, spaceflight induced osteopenia, osteopenia mice, induced osteopenia, osteopenia, dietary countermeasure mitigates, dietary countermeasure, dietary",https://www.ncbi.nlm.nih.gov/pmc/articles/PMC7162976/,1536
441,Simulated microgravity alters gene regulation linked to immunity and cardiovascular disease,"microgravity alters gene, immunity cardiovascular, simulated microgravity, simulated microgravity alters, linked immunity cardiovascular, immunity cardiovascular disease, microgravity alters, microgravity",https://www.ncbi.nlm.nih.gov/pmc/articles/PMC11353732/,1536
442,Autophagy and its consequences for platelet biology,"autophagy consequences platelet, platelet biology, autophagy consequences, consequences platelet biology, autophagy, platelet, consequences platelet, biology",https://www.ncbi.nlm.nih.gov/pmc/articles/PMC11953390/,1536
443,A new role of NAP1L1 in megakaryocytes and human platelets,"role nap1l1 megakaryocytes, nap1l1 megakaryocytes, nap1l1 megakaryocytes human, megakaryocytes human platelets, nap1l1, human platelets, platelets, new role nap1l1",https://www.ncbi.nlm.nih.gov/pmc/articles/PMC9737020/,1536
444,Evaluation of rodent spaceflight in the NASA animal enclosure module for an extended operational period (up to 35 days),"evaluation rodent spaceflight, rodent spaceflight nasa, rodent spaceflight, nasa animal enclosure, spaceflight nasa animal, animal enclosure module, evaluation rodent, nasa animal",https://www.ncbi.nlm.nih.gov/pmc/articles/PMC5515519/,1536
445,Morphology of Penicillium rubens Biofilms Formed in Space,"penicillium rubens biofilms, rubens biofilms formed, morphology penicillium rubens, biofilms formed space, morphology penicillium, rubens biofilms, biofilms formed, penicillium rubens",https://www.ncbi.nlm.nih.gov/pmc/articles/PMC10144393/,1536
446,Explainable machine learning identifies multi-omics signatures of muscle response to spaceflight in mice,"muscle response spaceflight, response spaceflight mice, spaceflight mice, omics signatures muscle, signatures muscle response, muscle response, muscle, response spaceflight",https://www.ncbi.nlm.nih.gov/pmc/articles/PMC10719374/,1536
447,Microbial adaptation to spaceflight is correlated with bacteriophage-encoded functions,"microbial adaptation spaceflight, spaceflight correlated bacteriophage, microbial adaptation, bacteriophage encoded functions, adaptation spaceflight, adaptation spaceflight correlated, bacteriophage encoded, bacteriophage",https://www.ncbi.nlm.nih.gov/pmc/articles/PMC11096397/,1536
448,Influence of the spaceflight environment on macrophage lineages,"spaceflight environment macrophage, environment macrophage lineages, macrophage lineages, environment macrophage, macrophage, influence spaceflight environment, spaceflight environment, influence spaceflight",https://www.ncbi.nlm.nih.gov/pmc/articles/PMC11166655/,1536
449,MARSBOx: Fungal and bacterial endurance from a balloon-flown analog mission in the stratosphere,"bacterial endurance balloon, marsbox fungal bacterial, fungal bacterial endurance, marsbox fungal, fungal bacterial, endurance balloon flown, bacterial endurance, fungal",https://www.ncbi.nlm.nih.gov/pmc/articles/PMC7937622/,1536
450,In situ linkage of fungal and bacterial proliferation to microbiologically influenced corrosion in B20 biodiesel storage tanks.,"corrosion b20 biodiesel, microbiologically influenced corrosion, biodiesel storage tanks, b20 biodiesel storage, fungal bacterial, biodiesel storage, fungal bacterial proliferation, b20 biodiesel",https://www.ncbi.nlm.nih.gov/pmc/articles/PMC7055474/,1536
451,"Identification of metagenome-assembled genomes containing antimicrobial resistance genes, isolated from an advanced water treatment facility.","genomes containing antimicrobial, antimicrobial resistance genes, metagenome assembled genomes, identification metagenome assembled, antimicrobial resistance, containing antimicrobial resistance, identification metagenome, assembled genomes containing",https://www.ncbi.nlm.nih.gov/pmc/articles/PMC7118179/,1536
452,Nature of pre-earthquake phenomena and their effects on living organisms,"pre earthquake phenomena, nature pre earthquake, pre earthquake, earthquake phenomena, earthquake phenomena effects, earthquake, effects living organisms, phenomena effects living",https://www.ncbi.nlm.nih.gov/pmc/articles/PMC4494396/,1536
453,The rapid diagnosis and effective inhibition of coronavirus using spike antibody attached gold nanoparticles,"inhibition coronavirus using, inhibition coronavirus, effective inhibition coronavirus, coronavirus using, coronavirus using spike, gold nanoparticles, coronavirus, attached gold nanoparticles",https://www.ncbi.nlm.nih.gov/pmc/articles/PMC8323809/,1536
454,Blocking SARS-CoV-2 Delta variant (B.1.617.2) spike protein receptor-binding domain binding with the ACE2 receptor of the host cell and inhibiting virus infections using human host defense peptide-conjugated graphene quantum dots.,"graphene quantum dots, peptide conjugated graphene, conjugated graphene quantum, conjugated graphene, graphene quantum, graphene, ace2 receptor host, binding ace2 receptor",https://www.ncbi.nlm.nih.gov/pmc/articles/PMC8886715/,1536
455,Safety and pharmacokinetics of intranasally administered heparin,"intranasally administered heparin, administered heparin, heparin, pharmacokinetics intranasally administered, safety pharmacokinetics intranasally, pharmacokinetics intranasally, intranasally administered, safety pharmacokinetics",https://www.ncbi.nlm.nih.gov/pmc/articles/PMC8890767/,1536
456,Inhibition of SARS-CoV-2 wild-type (Wuhan-Hu-1) and Delta (B.1.617.2) strains by marine sulfated glycans.,"marine sulfated glycans, sulfated glycans, inhibition sars cov, strains marine sulfated, glycans, inhibition sars, marine sulfated, sars cov wild",https://www.ncbi.nlm.nih.gov/pmc/articles/PMC9487896/,1536
457,Inhibition of Cytomegalovirus by Pentacta pygmaea Fucosylated Chondroitin Sulfate Depends on Its Molecular Weight,"cytomegalovirus pentacta pygmaea, inhibition cytomegalovirus pentacta, pygmaea fucosylated chondroitin, cytomegalovirus pentacta, inhibition cytomegalovirus, pentacta pygmaea fucosylated, cytomegalovirus, fucosylated chondroitin sulfate",https://www.ncbi.nlm.nih.gov/pmc/articles/PMC10142442/,1536
458,Effect of simulated cosmic radiation on cytomegalovirus reactivation and lytic replication,"cosmic radiation cytomegalovirus, radiation cytomegalovirus reactivation, radiation cytomegalovirus, cytomegalovirus reactivation lytic, cytomegalovirus reactivation, cytomegalovirus, simulated cosmic radiation, cosmic radiation",https://www.ncbi.nlm.nih.gov/pmc/articles/PMC11477029/,1536
459,A Tissue Retrieval and Postharvest Processing Regimen for Rodent Reproductive Tissues Compatible with Long-Term Storage on the International Space Station and Postflight Biospecimen Sharing Program,"rodent reproductive tissues, tissue retrieval postharvest, rodent reproductive, regimen rodent reproductive, tissue retrieval, reproductive tissues compatible, reproductive tissues, processing regimen rodent",https://www.ncbi.nlm.nih.gov/pmc/articles/PMC4309301/,1536
460,Effects of sex and gender on adaptations to space: reproductive health,"space reproductive health, space reproductive, gender adaptations space, sex gender adaptations, adaptations space reproductive, gender adaptations, effects sex gender, effects sex",https://www.ncbi.nlm.nih.gov/pmc/articles/PMC11166981/,1536
461,Effects of spaceflight on the muscles of the murine shoulder.,"spaceflight muscles murine, effects spaceflight muscles, spaceflight muscles, muscles murine shoulder, murine shoulder, muscles murine, effects spaceflight, shoulder",https://www.ncbi.nlm.nih.gov/pmc/articles/PMC6343501/,1536
462,Multiscale effects of spaceflight on murine tendon and bone,"spaceflight murine tendon, effects spaceflight murine, murine tendon bone, murine tendon, spaceflight murine, tendon bone, effects spaceflight, multiscale effects spaceflight",https://www.ncbi.nlm.nih.gov/pmc/articles/PMC7138367/,1536
463,Reproducible changes in the gut microbiome suggest a shift in microbial and host metabolism during spaceflight.,"changes gut microbiome, gut microbiome, gut microbiome suggest, microbial host metabolism, host metabolism spaceflight, microbiome, microbiome suggest shift, metabolism spaceflight",https://www.ncbi.nlm.nih.gov/pmc/articles/PMC6689164/,1536
464,Failure to Generate Bone Marrow Adipocytes Does Not Protect Mice from Ovariectomy-Induced Osteopenia,"ovariectomy induced osteopenia, bone marrow adipocytes, marrow adipocytes does, marrow adipocytes, adipocytes does protect, induced osteopenia, adipocytes, protect mice ovariectomy",https://www.ncbi.nlm.nih.gov/pmc/articles/PMC3564669/,1536
465,Acute exposure to high dose gamma-radiation results in transient activation of bone lining cells,"gamma radiation, dose gamma radiation, high dose gamma, gamma radiation results, activation bone lining, dose gamma, transient activation bone, bone lining cells",https://www.ncbi.nlm.nih.gov/pmc/articles/PMC4042434/,1536
466,Morbid obesity attenuates the skeletal abnormalities associated with leptin deficiency in mice,"leptin deficiency mice, associated leptin deficiency, leptin deficiency, abnormalities associated leptin, associated leptin, leptin, obesity attenuates skeletal, morbid obesity attenuates",https://www.ncbi.nlm.nih.gov/pmc/articles/PMC4161659/,1536
467,Hypothalamic leptin gene therapy reduces body weight without accelerating age-related bone loss,"hypothalamic leptin gene, hypothalamic leptin, leptin gene therapy, leptin gene, reduces body weight, leptin, bone loss, related bone loss",https://www.ncbi.nlm.nih.gov/pmc/articles/PMC4917201/,1536
468,Hypothalamic Leptin Gene Therapy Reduces Bone Marrow Adiposity in ob/ob Mice Fed Regular and High-Fat Diets.,"hypothalamic leptin gene, hypothalamic leptin, leptin gene therapy, bone marrow adiposity, leptin gene, marrow adiposity ob, marrow adiposity, adiposity",https://www.ncbi.nlm.nih.gov/pmc/articles/PMC4985531/,1536
469,Room temperature housing results in premature cancellous bone loss in growing female mice: implications for the mouse as a preclinical model for age-related bone loss.,"bone loss growing, growing female mice, female mice implications, bone loss, related bone loss, cancellous bone loss, female mice, mice implications",https://www.ncbi.nlm.nih.gov/pmc/articles/PMC5421618/,1536
470,Spaceflight-induced vertebral bone loss in ovariectomized rats is associated with increased bone marrow adiposity and no change in bone formation,"spaceflight induced vertebral, bone loss ovariectomized, vertebral bone loss, adiposity change bone, bone marrow adiposity, bone loss, loss ovariectomized rats, induced vertebral bone",https://www.ncbi.nlm.nih.gov/pmc/articles/PMC5515514/,1536
471,Role of oestrogen receptor signaling in skeletal response to leptin in female ob/ob mice.,"skeletal response leptin, response leptin female, oestrogen receptor signaling, role oestrogen receptor, leptin female, oestrogen receptor, leptin female ob, response leptin",https://www.ncbi.nlm.nih.gov/pmc/articles/PMC8671758/,1536
472,Effects of hypothalamic leptin gene therapy on osteopetrosis in leptin-deficient mice.,"osteopetrosis leptin deficient, therapy osteopetrosis leptin, osteopetrosis leptin, hypothalamic leptin gene, leptin deficient mice, hypothalamic leptin, leptin gene therapy, effects hypothalamic leptin",https://www.ncbi.nlm.nih.gov/pmc/articles/PMC5771473/,1536
473,Leptin stimulates bone formation in ob/ob mice at doses having minimal impact on energy metabolism.,"leptin stimulates bone, leptin stimulates, leptin, stimulates bone formation, bone formation ob, bone formation, ob mice doses, stimulates bone",https://www.ncbi.nlm.nih.gov/pmc/articles/PMC5288125/,1536
474,Bone Marrow Adipose Tissue Deficiency Increases Disuse-Induced Bone Loss in Male Mice,"bone marrow adipose, marrow adipose, adipose tissue deficiency, induced bone loss, marrow adipose tissue, bone loss male, bone loss, loss male mice",https://www.ncbi.nlm.nih.gov/pmc/articles/PMC5389344/,1536
475,Metabolic Coupling Between Bone Marrow Adipose Tissue and Hematopoiesis,"adipose tissue hematopoiesis, bone marrow adipose, marrow adipose, marrow adipose tissue, metabolic coupling bone, adipose tissue, coupling bone marrow, tissue hematopoiesis",https://www.ncbi.nlm.nih.gov/pmc/articles/PMC9784906/,1536
476,Maintenance of near normal bone mass and architecture in lethally irradiated female mice following adoptive transfer with as few as 750 purified hematopoietic stem cells.,"irradiated female mice, hematopoietic stem cells, stem cells, mice following adoptive, lethally irradiated female, irradiated female, hematopoietic stem, purified hematopoietic stem",https://www.ncbi.nlm.nih.gov/pmc/articles/PMC6548323/,1536
477,Effect of leptin deficiency on the skeletal response to hindlimb unloading in adult male mice.,"leptin deficiency skeletal, effect leptin deficiency, leptin deficiency, effect leptin, leptin, skeletal response hindlimb, deficiency skeletal response, deficiency skeletal",https://www.ncbi.nlm.nih.gov/pmc/articles/PMC6597714/,1536
478,Thermoneutral housing attenuates premature cancellous bone loss in male C57BL/6J mice,"bone loss, cancellous bone loss, bone loss male, thermoneutral housing attenuates, premature cancellous bone, thermoneutral, thermoneutral housing, cancellous bone",https://www.ncbi.nlm.nih.gov/pmc/articles/PMC6865368/,1536
479,Effects of Spaceflight on Cancellous and Cortical Bone in Proximal Femur in Growing Rats,"femur growing rats, bone proximal femur, cortical bone proximal, proximal femur growing, femur growing, cortical bone, cancellous cortical bone, proximal femur",https://www.ncbi.nlm.nih.gov/pmc/articles/PMC7907224/,1536
480,Evidence for increased thermogenesis in female C57BL/6J mice housed aboard the international space station,"thermogenesis female c57bl, increased thermogenesis female, thermogenesis female, increased thermogenesis, c57bl 6j mice, evidence increased thermogenesis, 6j mice housed, mice housed aboard",https://www.ncbi.nlm.nih.gov/pmc/articles/PMC8213760/,1536
481,Leptin and environmental temperature as determinants of bone marrow adiposity in female mice,"adiposity female mice, leptin environmental temperature, bone marrow adiposity, marrow adiposity female, marrow adiposity, leptin environmental, leptin, adiposity",https://www.ncbi.nlm.nih.gov/pmc/articles/PMC9582271/,1536
482,Small changes in thermoregulation influence cancellous bone turnover balance in distal femur metaphysis in growing female mice,"distal femur metaphysis, femur metaphysis growing, femur metaphysis, balance distal femur, bone turnover balance, distal femur, bone turnover, cancellous bone turnover",https://www.ncbi.nlm.nih.gov/pmc/articles/PMC10063413/,1536
483,Bone Marrow Adipose Tissue Is Not Required for Reconstitution of the Immune System Following Irradiation in Male Mice,"irradiation male mice, bone marrow adipose, immune following irradiation, marrow adipose tissue, marrow adipose, following irradiation male, irradiation male, adipose tissue required",https://www.ncbi.nlm.nih.gov/pmc/articles/PMC10889206/,1536
484,Simulated Microgravity Promotes Horizontal Gene Transfer of Antimicrobial Resistance Genes between Bacterial Genera in the Absence of Antibiotic Selective Pressure,"resistance genes bacterial, antimicrobial resistance genes, gene transfer antimicrobial, transfer antimicrobial resistance, genes bacterial, antimicrobial resistance, genes bacterial genera, antibiotic selective pressure",https://www.ncbi.nlm.nih.gov/pmc/articles/PMC8468678/,1536
485,Understanding the Complexities and Changes of the Astronaut Microbiome for Successful Long-Duration Space Missions,"changes astronaut microbiome, astronaut microbiome successful, astronaut microbiome, microbiome, microbiome successful, microbiome successful long, changes astronaut, complexities changes astronaut",https://www.ncbi.nlm.nih.gov/pmc/articles/PMC9031868/,1536
486,Toward sustainable space exploration: a roadmap for harnessing the power of microorganisms.,"sustainable space exploration, harnessing power microorganisms, sustainable space, space exploration roadmap, microorganisms, power microorganisms, space exploration, exploration roadmap harnessing",https://www.ncbi.nlm.nih.gov/pmc/articles/PMC10030976/,1536
487,Roll maneuvers are essential for active reorientation of Caenorhabditis elegans in 3D media,"reorientation caenorhabditis elegans, caenorhabditis elegans 3d, elegans 3d media, caenorhabditis elegans, elegans 3d, elegans, active reorientation caenorhabditis, reorientation caenorhabditis",https://www.ncbi.nlm.nih.gov/pmc/articles/PMC5910807/,1536
488,Microfluidic Device for Studying Nematodes,"device studying nematodes, studying nematodes, microfluidic device studying, microfluidic device, microfluidic, nematodes, device studying, device",https://www.ncbi.nlm.nih.gov/pmc/articles/PMC12021249/,1536
489,NemaFlex: A microfluidics-based technology for standardized measurement of muscular strength of C. elegans.,"muscular strength elegans, strength elegans, nemaflex microfluidics based, nemaflex microfluidics, elegans, microfluidics, measurement muscular strength, standardized measurement muscular",https://www.ncbi.nlm.nih.gov/pmc/articles/PMC6057834/,1536
490,"Swim exercise in Caenorhabditis elegans extends neuromuscular and gut healthspan, enhances learning ability, and protects against neurodegeneration","elegans extends neuromuscular, exercise caenorhabditis elegans, swim exercise caenorhabditis, neuromuscular gut healthspan, caenorhabditis elegans, caenorhabditis elegans extends, swim exercise, neuromuscular gut",https://www.ncbi.nlm.nih.gov/pmc/articles/PMC6876156/,1536
491,Molecular muscle experiment: Hardware and operational lessons for future astrobiology space experiments,"molecular muscle experiment, astrobiology space experiments, muscle experiment hardware, molecular muscle, future astrobiology space, future astrobiology, lessons future astrobiology, muscle experiment",https://www.ncbi.nlm.nih.gov/pmc/articles/PMC7415877/,1536
492,Tart Cherry Increases Lifespan in Caenorhabditis elegans by Altering Metabolic Signaling Pathways,"cherry increases lifespan, lifespan caenorhabditis elegans, elegans altering metabolic, tart cherry increases, caenorhabditis elegans altering, tart cherry, metabolic signaling pathways, caenorhabditis elegans",https://www.ncbi.nlm.nih.gov/pmc/articles/PMC7285199/,1536
493,A region of UNC-89 (obscurin) lying between two protein kinase domains is a highly elastic spring required for proper sarcomere organization,"proper sarcomere organization, sarcomere organization, kinase domains highly, kinase domains, required proper sarcomere, protein kinase domains, protein kinase, obscurin lying protein",https://www.ncbi.nlm.nih.gov/pmc/articles/PMC9549344/,1536
494,NemaLife chip: a micropillar-based microfluidic culture device optimized for aging studies in crawling C. elegans,"nemalife chip micropillar, micropillar based microfluidic, studies crawling elegans, crawling elegans, chip micropillar, chip micropillar based, microfluidic culture device, micropillar based",https://www.ncbi.nlm.nih.gov/pmc/articles/PMC7530743/,1536
495,Spaceflight affects neuronal morphology and alters transcellular degradation of neuronal debris in adult Caenorhabditis elegans,"degradation neuronal debris, spaceflight affects neuronal, transcellular degradation neuronal, neuronal debris, neuronal debris adult, caenorhabditis elegans, adult caenorhabditis elegans, degradation neuronal",https://www.ncbi.nlm.nih.gov/pmc/articles/PMC7890410/,1536
496,Microfluidics-integrated spaceflight hardware for measuring muscle strength of Caenorhabditis elegans on the International Space Station.,"strength caenorhabditis elegans, elegans international space, caenorhabditis elegans international, caenorhabditis elegans, microfluidics integrated spaceflight, elegans, hardware measuring muscle, microfluidics",https://www.ncbi.nlm.nih.gov/pmc/articles/PMC9640571/,1536
497,A Compact Imaging Platform for Conducting C. elegans Phenotypic Assays on Earth and in Spaceflight.,"elegans phenotypic assays, conducting elegans phenotypic, platform conducting elegans, elegans phenotypic, conducting elegans, elegans, compact imaging platform, imaging platform",https://www.ncbi.nlm.nih.gov/pmc/articles/PMC9862956/,1536
498,Mitochondrial sulfide promotes life span and health span through distinct mechanisms in developing versus adult treated Caenorhabditis elegans.,"mitochondrial sulfide promotes, mitochondrial sulfide, sulfide promotes life, treated caenorhabditis elegans, caenorhabditis elegans, sulfide promotes, mitochondrial, elegans",https://www.ncbi.nlm.nih.gov/pmc/articles/PMC10410709/,1536
499,Bisphosphonates attenuate age-related muscle decline in Caenorhabditis elegans.,"bisphosphonates attenuate age, decline caenorhabditis elegans, bisphosphonates attenuate, bisphosphonates, muscle decline caenorhabditis, caenorhabditis elegans, age related muscle, elegans",https://www.ncbi.nlm.nih.gov/pmc/articles/PMC10751425/,1536
500,Spaceflight Induces Strength Decline in Caenorhabditis elegans,"decline caenorhabditis elegans, caenorhabditis elegans, elegans, spaceflight induces strength, strength decline caenorhabditis, induces strength decline, induces strength, spaceflight induces",https://www.ncbi.nlm.nih.gov/pmc/articles/PMC10605753/,1536
501,Metabolic model predictions enable targeted microbiome manipulation through precision prebiotics.,"microbiome manipulation precision, precision prebiotics, enable targeted microbiome, targeted microbiome manipulation, manipulation precision prebiotics, targeted microbiome, microbiome manipulation, prebiotics",https://www.ncbi.nlm.nih.gov/pmc/articles/PMC10846184/,1536
502,Transcriptomics analysis reveals molecular alterations underpinning spaceflight dermatology.,"underpinning spaceflight dermatology, spaceflight dermatology, transcriptomics analysis reveals, alterations underpinning spaceflight, transcriptomics analysis, transcriptomics, underpinning spaceflight, spaceflight",https://www.ncbi.nlm.nih.gov/pmc/articles/PMC11166967/,1536
503,Identification and characterization of a skin microbiome on Caenorhabditis elegans suggests environmental microbes confer cuticle protection,"microbiome caenorhabditis elegans, skin microbiome caenorhabditis, microbes confer cuticle, characterization skin microbiome, skin microbiome, microbiome caenorhabditis, environmental microbes, caenorhabditis elegans",https://www.ncbi.nlm.nih.gov/pmc/articles/PMC11302229/,1536
504,Protein kinase 2 of the giant sarcomeric protein UNC-89 regulates mitochondrial morphology and function,"89 regulates mitochondrial, regulates mitochondrial morphology, regulates mitochondrial, mitochondrial morphology function, mitochondrial morphology, sarcomeric protein unc, mitochondrial, kinase giant sarcomeric",https://www.ncbi.nlm.nih.gov/pmc/articles/PMC11487192/,1536
505,New perspectives on viable microbial communities in low-biomass cleanroom environments,"biomass cleanroom environments, microbial communities low, low biomass cleanroom, viable microbial communities, microbial communities, biomass cleanroom, communities low biomass, cleanroom environments",https://www.ncbi.nlm.nih.gov/pmc/articles/PMC3554398/,1536
506,Microbial existence in controlled habitats and their resistance to space conditions,"microbial existence controlled, microbial existence, microbial, existence controlled habitats, habitats resistance space, controlled habitats resistance, habitats resistance, controlled habitats",https://www.ncbi.nlm.nih.gov/pmc/articles/PMC10370681/,1536
507,Microbiomes of the dust particles collected from the International Space Station and Spacecraft assembly facilities,"microbiomes dust particles, microbiomes dust, dust particles collected, microbiomes, dust particles, dust, particles collected, particles collected international",https://www.ncbi.nlm.nih.gov/pmc/articles/PMC4624184/,1536
508,"Draft genome sequences of two Aspergillus fumigatus strains, isolated from the International Space Station","genome sequences aspergillus, sequences aspergillus fumigatus, aspergillus fumigatus strains, sequences aspergillus, aspergillus fumigatus, aspergillus, draft genome sequences, fumigatus strains isolated",https://www.ncbi.nlm.nih.gov/pmc/articles/PMC4945788/,1536
509,Characterization of Aspergillus fumigatus isolates from air and surfaces of the International Space Station.,"aspergillus fumigatus isolates, characterization aspergillus fumigatus, aspergillus fumigatus, characterization aspergillus, aspergillus, fumigatus isolates air, fumigatus isolates, isolates air",https://www.ncbi.nlm.nih.gov/pmc/articles/PMC9116463/,1536
